type,id,author,editor,advisor,note,title,pages,article_no,num_pages,keywords,doi,journal,issue_date,volume,issue_no,description,month,year,issn,booktitle,acronym,edition,isbn,conf_loc,publisher,publisher_loc
article,2502165,Tina  Walber and Chantal  Neuhaus and Steffen  Staab and Ansgar  Scherp and Ramesh  Jain,,,,Creation of Individual Photo Selections: Read Preferences from the Users' Eyes,629--632,,4,"eye tracking, personal interest, personalized photo selection",10.1145/2502081.2502165,,,,,,,2013,,Proceedings of the 21st ACM International Conference on Multimedia,MM '13,,978-1-4503-2404-5,"Barcelona, Spain",ACM,"New York, NY, USA"
article,2901805,Mona  Haraty and Joanna  McGrenere,,,,Designing for Advanced Personalization in Personal Task Management,239--250,,12,"meta-design, personal task management, personalization",10.1145/2901790.2901805,,,,,,,2016,,Proceedings of the 2016 ACM Conference on Designing Interactive Systems,DIS '16,,978-1-4503-4031-1,"Brisbane, QLD, Australia",ACM,"New York, NY, USA"
article,2993578,Alimohammad  Rabbani and S.  Keshav,,,,The SPOT* Personal Thermal Comfort System,75--84,,10,"Personal Environmental Comfort Systems, Personal Thermal Comfort",10.1145/2993422.2993578,,,,,,,2016,,Proceedings of the 3rd ACM International Conference on Systems for Energy-Efficient Built Environments,BuildSys '16,,978-1-4503-4264-3,"Palo Alto, CA, USA",ACM,"New York, NY, USA"
article,2380722,Yoram  Bachrach and Michal  Kosinski and Thore  Graepel and Pushmeet  Kohli and David  Stillwell,,,,Personality and Patterns of Facebook Usage,24--32,,9,"Personality, big five personality model, social networks",10.1145/2380718.2380722,,,,,,,2012,,Proceedings of the 4th Annual ACM Web Science Conference,WebSci '12,,978-1-4503-1228-8,"Evanston, Illinois",ACM,"New York, NY, USA"
article,1099622,Giridhar  Kumaran and Rosie  Jones and Omid  Madani,,,,Biasing Web Search Results for Topic Familiarity,271--272,,2,"familiarity, personalization, web search",10.1145/1099554.1099622,,,,,,,2005,,Proceedings of the 14th ACM International Conference on Information and Knowledge Management,CIKM '05,,1-59593-140-6,"Bremen, Germany",ACM,"New York, NY, USA"
article,1140122,Christoforos  Panayiotou and Maria  Andreou and George  Samaras,,,,Using Time and Activity in Personalization for the Mobile User,87--90,,4,"context, personalization, wireless users",10.1145/1140104.1140122,,,,,,,2006,,Proceedings of the 5th ACM International Workshop on Data Engineering for Wireless and Mobile Access,MobiDE '06,,1-59593-436-7,"Chicago, Illinois, USA",ACM,"New York, NY, USA"
article,1967595,Thiago  Arruda and Damires  Souza and Ana Carolina Salgado,,,,PSemRef: Personalized Query Reformulation Based on User Preferences,683--686,,4,"personalization, query reformulation, ranking",10.1145/1967486.1967595,,,,,,,2010,,Proceedings of the 12th International Conference on Information Integration and Web-based Applications &#38; Services,iiWAS '10,,978-1-4503-0421-4,"Paris, France",ACM,"New York, NY, USA"
article,266914,Kevin  Gary and Tim  Lindquist and Harry  Koehnemann and Ly  Sauer,,,,Automated Process Support for Organizational and Personal Processes,221--230,,10,"components, personal process, workflow",10.1145/266838.266914,,,,,,,1997,,Proceedings of the International ACM SIGGROUP Conference on Supporting Group Work: The Integration Challenge,GROUP '97,,0-89791-897-5,"Phoenix, Arizona, USA",ACM,"New York, NY, USA"
article,1111382,Carlos R. C. Alves and L&#250;cia V. L. Filgueiras,,,,Avalia\c{C}\~{A}O Comparativa De Algoritmos De Personaliza\c{C}\~{A}O Para Direcionamento De Conte\'{U}Do,211--222,,12,"content recommendation, personalization, usability",10.1145/1111360.1111382,,,,,,,2005,,Proceedings of the 2005 Latin American Conference on Human-computer Interaction,CLIHC '05,,1-59593-224-0,"Cuernavaca, Mexico",ACM,"New York, NY, USA"
article,1056005,Thomas W. Ferratt and Harvey G. Enns and Jayesh  Prasad,,,,An Empirical Comparison of Direct and Indirect Measures of Person-organization (P-O) Fit,146--148,,3,person-organization fit,10.1145/1055973.1056005,,,,,,,2005,,Proceedings of the 2005 ACM SIGMIS CPR Conference on Computer Personnel Research,SIGMIS CPR '05,,1-59593-011-6,"Atlanta, Georgia, USA",ACM,"New York, NY, USA"
article,2010097,David  Vallet and Pablo  Castells,,,,On Diversifying and Personalizing Web Search,1157--1158,,2,"diversity, personalization, web search",10.1145/2009916.2010097,,,,,,,2011,,Proceedings of the 34th International ACM SIGIR Conference on Research and Development in Information Retrieval,SIGIR '11,,978-1-4503-0757-4,"Beijing, China",ACM,"New York, NY, USA"
article,1555505,Naimdjon  Takhirov and Ingeborg T. S&#248;lvberg,,,,Adaptive Personalized eLearning on Top of Existing LCMS,445--446,,2,"eLearning, learning objects, personalization",10.1145/1555400.1555505,,,,,,,2009,,Proceedings of the 9th ACM/IEEE-CS Joint Conference on Digital Libraries,JCDL '09,,978-1-60558-322-8,"Austin, TX, USA",ACM,"New York, NY, USA"
article,2556211,Elizabeth F. Churchill and Atish  Das Sarma,,,,Data Design for Personalization: Current Challenges and Emerging Opportunities,693--694,,2,"data design, personalization, search",10.1145/2556195.2556211,,,,,,,2014,,Proceedings of the 7th ACM International Conference on Web Search and Data Mining,WSDM '14,,978-1-4503-2351-2,"New York, New York, USA",ACM,"New York, NY, USA"
article,2959054,Yousef  Amar and Hamed  Haddadi and Richard  Mortier,,,,Privacy-Aware Infrastructure for Managing Personal Data,571--572,,2,"Networks, Personal Data, Privacy",10.1145/2934872.2959054,,,,,,,2016,,Proceedings of the 2016 ACM SIGCOMM Conference,SIGCOMM '16,,978-1-4503-4193-6,"Florianopolis, Brazil",ACM,"New York, NY, USA"
article,564547,Krista  Coleman,,,,Electromyography Based Human-computer-interface to Induce Movement in Elderly Persons with Movement Impairments,75--79,,5,"EMG, HCI, rehabilitation, technology induced movement(TIM)",10.1145/564526.564547,,,,,,,2001,,Proceedings of the 2001 EC/NSF Workshop on Universal Accessibility of Ubiquitous Computing: Providing for the Elderly,WUAUC'01,,1-58113-424-X,"Alc&aacute;cer do Sal, Portugal",ACM,"New York, NY, USA"
article,1141862,Frederic  Stutzman and Terrell  Russell,,,,ClaimID: A System for Personal Identity Management,367--367,,1,"folksonomy, personal identity management",10.1145/1141753.1141862,,,,,,,2006,,Proceedings of the 6th ACM/IEEE-CS Joint Conference on Digital Libraries,JCDL '06,,1-59593-354-9,"Chapel Hill, NC, USA",ACM,"New York, NY, USA"
article,1979588,Raimund  Dachselt and Matt  Jones and Jonna  H&#228;kkil&#228; and Markus  L&#246;chtefeld and Michael  Rohs and Enrico  Rukzio,,,,Mobile and Personal Projection (MP2),21--23,,3,"interaction, mobile, personal, projection",10.1145/1979742.1979588,,,,,,,2011,,CHI '11 Extended Abstracts on Human Factors in Computing Systems,CHI EA '11,,978-1-4503-0268-5,"Vancouver, BC, Canada",ACM,"New York, NY, USA"
article,2213927,Anastasios  Arvanitis and Georgia  Koutrika,,,,PrefDB: Bringing Preferences Closer to the DBMS,665--668,,4,"preferences, query personalization",10.1145/2213836.2213927,,,,,,,2012,,Proceedings of the 2012 ACM SIGMOD International Conference on Management of Data,SIGMOD '12,,978-1-4503-1247-9,"Scottsdale, Arizona, USA",ACM,"New York, NY, USA"
article,2885501,Fabio Massimo Zanzotto and Lorenzo  Ferrone,,,,Have You Lost the Thread? Discovering Ongoing Conversations in Scattered Dialog Blocks,9:1--9:19,9,19,"Big Personal Data, Provacy",10.1145/2885501,ACM Trans. Interact. Intell. Syst.,Jul-17,7,2,,July,2017,2160-6455,,,,,,ACM,"New York, NY, USA"
article,1629102,Domenico  Rosaci and Giuseppe M. L. Sarn&#233; and Salvatore  Garruzzo,,,,MUADDIB: A Distributed Recommender System Supporting Device Adaptivity,24:1--24:41,24,41,"Recommender systems, adaptivity, personalization",10.1145/1629096.1629102,ACM Trans. Inf. Syst.,Nov-09,27,4,,November,2009,1046-8188,,,,,,ACM,"New York, NY, USA"
article,1864758,Il  Im and Byung Ho  Kim,,,,Personalizing the Settings for Cf-based Recommender Systems,245--248,,4,"collaborative filtering, netflix, personalization",10.1145/1864708.1864758,,,,,,,2010,,Proceedings of the Fourth ACM Conference on Recommender Systems,RecSys '10,,978-1-60558-906-0,"Barcelona, Spain",ACM,"New York, NY, USA"
article,1330592,Martin  Kurze,,,,Personalization in Multimodal Interfaces,23--26,,4,"adaptation, multmodality, personalization",10.1145/1330588.1330592,,,,,,,2007,,"Proceedings of the 2007 Workshop on Tagging, Mining and Retrieval of Human Related Activity Information",TMR '07,,978-1-59593-870-1,"Nagoya, Japan",ACM,"New York, NY, USA"
article,2414431,Keyi  Shen and Jianmin  Wu and Ya  Zhang and Yiping  Han and Xiaokang  Yang and Li  Song and Xiao  Gu,,,,Reorder User's Tweets,6:1--6:17,6,17,"Personalization, reorder, retweet, twitter",10.1145/2414425.2414431,ACM Trans. Intell. Syst. Technol.,Jan-13,4,1,,February,2013,2157-6904,,,,,,ACM,"New York, NY, USA"
article,3099114,Gustavo F. Tondello and Rita  Orji and Lennart E. Nacke,,,,Recommender Systems for Personalized Gamification,425--430,,6,"gamification, personalization, recommender systems",10.1145/3099023.3099114,,,,,,,2017,,"Adjunct Publication of the 25th Conference on User Modeling, Adaptation and Personalization",UMAP '17,,978-1-4503-5067-9,"Bratislava, Slovakia",ACM,"New York, NY, USA"
article,2567991,Yisong  Yue and Chong  Wang and Khalid  El-Arini and Carlos  Guestrin,,,,Personalized Collaborative Clustering,75--84,,10,"clustering, personalization, tensor factorization",10.1145/2566486.2567991,,,,,,,2014,,Proceedings of the 23rd International Conference on World Wide Web,WWW '14,,978-1-4503-2744-2,"Seoul, Korea",ACM,"New York, NY, USA"
article,1005158,Lorrie Faith Cranor,,,,'I Didn'T Buy It for Myself' Privacy and Ecommerce Personalization,111--117,,7,"ecommerce, personalization, privacy",10.1145/1005140.1005158,,,,,,,2003,,Proceedings of the 2003 ACM Workshop on Privacy in the Electronic Society,WPES '03,,1-58113-776-1,"Washington, DC",ACM,"New York, NY, USA"
article,1296962,Reid  Priedhorsky and Benjamin  Jordan and Loren  Terveen,,,,How a Personalized Geowiki Can Help Bicyclists Share Information More Effectively,93--98,,6,"geography, geowiki, personalization, wiki",10.1145/1296951.1296962,,,,,,,2007,,Proceedings of the 2007 International Symposium on Wikis,WikiSym '07,,978-1-59593-861-9,"Montreal, Quebec, Canada",ACM,"New York, NY, USA"
article,3099061,Styliani  Kleanthous and Grigoris  Michael and George  Samaras and Vania  Dimitrova,,,,Individual Differences in Music Video Interaction: An Exploratory Analysis,241--246,,6,"analytics, individual characteristics: personalization",10.1145/3099023.3099061,,,,,,,2017,,"Adjunct Publication of the 25th Conference on User Modeling, Adaptation and Personalization",UMAP '17,,978-1-4503-5067-9,"Bratislava, Slovakia",ACM,"New York, NY, USA"
article,2856461,Stefanie  Mueller and Laura  Devendorf and Stelian  Coros and Yoichi  Ochiai and Madeline  Gannon and Patrick  Baudisch,,,,"CrossFAB: Bridging the Gap Between Personal Fabrication Research in HCI, Computer Graphics, Robotics, Art, Architecture, and Material Science.",3431--3437,,7,"interdisciplinary research, personal fabrication",10.1145/2851581.2856461,,,,,,,2016,,Proceedings of the 2016 CHI Conference Extended Abstracts on Human Factors in Computing Systems,CHI EA '16,,978-1-4503-4082-3,"San Jose, California, USA",ACM,"New York, NY, USA"
article,2365957,Maria Augusta S.N. Nunes and Rong  Hu,,,,Personality-based Recommender Systems: An Overview,5--6,,2,personality-based recommender systems,10.1145/2365952.2365957,,,,,,,2012,,Proceedings of the Sixth ACM Conference on Recommender Systems,RecSys '12,,978-1-4503-1270-7,"Dublin, Ireland",ACM,"New York, NY, USA"
article,2959201,Marko  Tkalcic and Berardina  De Carolis and Marco  de Gemmis and Andrej  Kosir,,,,4th Workshop on Emotions and Personality in Personalized Systems (EMPIRE),407--407,,1,"emotions, personality, recommender systems",10.1145/2959100.2959201,,,,,,,2016,,Proceedings of the 10th ACM Conference on Recommender Systems,RecSys '16,,978-1-4503-4035-9,"Boston, Massachusetts, USA",ACM,"New York, NY, USA"
article,2616127,Pradeep K. Murukannaiah and Ricard  Fogues and Munindar P. Singh,,,,Platys: A Framework for Supporting Context-aware Personal Agents,1689--1690,,2,"context, middleware, personal agent",,,,,,,,2014,,Proceedings of the 2014 International Conference on Autonomous Agents and Multi-agent Systems,AAMAS '14,,978-1-4503-2738-1,"Paris, France",International Foundation for Autonomous Agents and Multiagent Systems,"Richland, SC"
article,2052431,Maria Soledad Pera and Yiu-Kai  Ng,,,,With a Little Help from My Friends: Generating Personalized Book Recommendations Using Data Extracted from a Social Website,96--99,,4,"recommendation, personalization, word-similarity",10.1109/WI-IAT.2011.9,,,,,,,2011,,Proceedings of the 2011 IEEE/WIC/ACM International Conferences on Web Intelligence and Intelligent Agent Technology - Volume 01,WI-IAT '11,,978-0-7695-4513-4,,IEEE Computer Society,"Washington, DC, USA"
article,3225228,Frederic  Raber and Antonio  Kr&#252;ger,,,,Privacy Perceiver: Using Social Network Posts to Derive Users' Privacy Measures,227--232,,6,"machine learning, prediction, privacy measures, social networks, text analysis, user modeling",10.1145/3213586.3225228,,,,,,,2018,,"Adjunct Publication of the 26th Conference on User Modeling, Adaptation and Personalization",UMAP '18,,978-1-4503-5784-5,"Singapore, Singapore",ACM,"New York, NY, USA"
article,2826224,Thomas  Hofer and Michael  Schumacher and Stefano  Bromuri,,,,COMPASS: An Interoperable Personal Health System to Monitor and Compress Signals in Chronic Obstructive Pulmonary Disease,304--311,,8,"compression, copd, interoperability, mobile, soa",,,,,,,,2015,,Proceedings of the 9th International Conference on Pervasive Computing Technologies for Healthcare,PervasiveHealth '15,,978-1-63190-045-7,"Istanbul, Turkey","ICST (Institute for Computer Sciences, Social-Informatics and Telecommunications Engineering)","ICST, Brussels, Belgium, Belgium"
article,2901841,Marijke  Vandermaesen and Tom  De Weyer and Peter  Feys and Kris  Luyten and Karin  Coninx,,,,Integrating Serious Games and Tangible Objects for Functional Handgrip Training: A User Study of Handly in Persons with Multiple Sclerosis.,924--935,,12,"handgrip tasks, neurorehabilitation, occupational therapy, pervasive serious games, tangible objects",10.1145/2901790.2901841,,,,,,,2016,,Proceedings of the 2016 ACM Conference on Designing Interactive Systems,DIS '16,,978-1-4503-4031-1,"Brisbane, QLD, Australia",ACM,"New York, NY, USA"
article,372398,Fabio Asturian Zanin and Lisandro Zambenedetti Granville and Maria Janilce Almeida,,,,ADAPT - a Low-cost Videoconference Model for Personal Computers Running on IP Networks,446--447,,2,"IP, computer networks, internet, video, videoconference",10.1145/372202.372398,,,,,,,2001,,Proceedings of the 2001 ACM Symposium on Applied Computing,SAC '01,,1-58113-287-5,"Las Vegas, Nevada, USA",ACM,"New York, NY, USA"
article,1713538,David H. Nguyen and Gillian R. Hayes,,,,Information Privacy in Institutional and End-user Tracking and Recording Technologies,53--72,,20,"End-user, Information privacy, Institutional, Tracking and recording technologies, User attitudes",10.1007/s00779-009-0229-4,Personal Ubiquitous Comput.,Jan-10,14,1,,January,2010,1617-4909,,,,,,Springer-Verlag,"London, UK, UK"
article,2801950,Vassilis  Fotopoulos and Anastasios  Fanariotis and Theofanis  Orphanoudakis and Athanassios N. Skodras,,,,Remote FPGA Laboratory Course Development Based on an Open Multimodal Laboratory Facility,447--452,,6,"FPGA, VHDL, distance learning, online course, remote lab",10.1145/2801948.2801950,,,,,,,2015,,Proceedings of the 19th Panhellenic Conference on Informatics,PCI '15,,978-1-4503-3551-5,"Athens, Greece",ACM,"New York, NY, USA"
article,2506685,Charles L. Cole and Brian R. King,,,,Using Machine Learning to Predict the Health of HIV-Infected Patients,684:684--684:685,684,2,"HIV, decision tree, n-gram model, random forest, sequence analysis",10.1145/2506583.2506685,,,,,,,2013,,"Proceedings of the International Conference on Bioinformatics, Computational Biology and Biomedical Informatics",BCB'13,,978-1-4503-2434-2,"Wshington DC, USA",ACM,"New York, NY, USA"
article,2345485,Sk Hafizul Islam and G. P. Biswas,,,,Certificateless Strong Designated Verifier Multisignature Scheme Using Bilinear Pairings,540--546,,7,"bilinear pairing, certificateless cryptography, designated verifier, elliptic curve cryptography, multisignature",10.1145/2345396.2345485,,,,,,,2012,,"Proceedings of the International Conference on Advances in Computing, Communications and Informatics",ICACCI '12,,978-1-4503-1196-0,"Chennai, India",ACM,"New York, NY, USA"
article,97410,Harina  Kapoor,,,,High Quality Speech for Laryngectomized Persons,128--133,,6,,10.1145/97351.97410,SIGCAS Comput. Soc.,Oct. 1990,20,3,,August,1990,0095-2737,,,,,,ACM,"New York, NY, USA"
article,97410,Harina  Kapoor,,,,High Quality Speech for Laryngectomized Persons,128--133,,6,,10.1145/97344.97410,,,,,,,1990,,Proceedings of the Conference on Computers and the Quality of Life,CQL '90,,0-89791-403-1,"George Washington University, Washington, D.C., USA",ACM,"New York, NY, USA"
article,2875234,Anton  Fedosov and Ivan  Elhart and Evangelos  Niforatos and Alexander  North and Marc  Langheinrich,,,,SkiAR: Wearable Augmented Reality System for Sharing Personalized Content on Ski Resort Maps,46:1--46:2,46,2,"Information sharing, augmented reality system, skiing, wearables",10.1145/2875194.2875234,,,,,,,2016,,Proceedings of the 7th Augmented Human International Conference 2016,AH '16,,978-1-4503-3680-2,"Geneva, Switzerland",ACM,"New York, NY, USA"
book,61975,,Adele  Goldberg,,,,,,,,,,,,,,,1988,,A History of Personal Workstations,,,0-201-11259-0,,ACM,"New York, NY, USA"
article,1731499,Yvonne  Rogers and Kay  Connelly and William  Hazlewood and Lenore  Tedesco,,,,Enhancing Learning: A Study of How Mobile Devices Can Facilitate Sensemaking,111--124,,14,"Collaboration, Mobile learning, Mobile technologies, Sensemaking",10.1007/s00779-009-0250-7,Personal Ubiquitous Comput.,Feb-10,14,2,,February,2010,1617-4909,,,,,,Springer-Verlag,"London, UK, UK"
technical report,3185594,Michael E. Caspersen and Judith  Gal-Ezer and Andrew  McGettrick and Enrico  Nardelli,,,,,,,,,,,,,,,,2018,,Informatics for All The Strategy,,,,,ACM,"New York, NY, USA"
article,2975213,Edward W. Huang and Sheng  Wang and Runshun  Zhang and Baoyan  Liu and Xuezhong  Zhou and ChengXiang  Zhai,,,,PaReCat: Patient Record Subcategorization for Precision Traditional Chinese Medicine,443--452,,10,"network embedding, patient record subcategorization, traditional Chinese medicine",10.1145/2975167.2975213,,,,,,,2016,,"Proceedings of the 7th ACM International Conference on Bioinformatics, Computational Biology, and Health Informatics",BCB '16,,978-1-4503-4225-4,"Seattle, WA, USA",ACM,"New York, NY, USA"
article,2512356,Francesco  Pappalardo and Marzio  Pennisi and Ferdinando  Chiacchio and Salvatore  Musumeci and Santo  Motta,,,,iAtheroSim: Atherosclerosis Process Simulator on Smart Devices,815:815--815:817,815,3,"Simulations, agent based models, smart devices apps, translational research",10.1145/2506583.2512356,,,,,,,2013,,"Proceedings of the International Conference on Bioinformatics, Computational Biology and Biomedical Informatics",BCB'13,,978-1-4503-2434-2,"Wshington DC, USA",ACM,"New York, NY, USA"
article,1348805,Nagendra Bhargava Bharatula and Paul  Lukowicz and Gerhard  Tr&#x00f6;ster,,,,Functionality-power-packaging Considerations in Context Aware Wearable Systems,123--141,,19,"Context recognition, Electronic packaging, Functionality, Gesture, Miniaturization, Wearable computing",10.1007/s00779-006-0106-3,Personal Ubiquitous Comput.,Jan-08,12,2,,January,2008,1617-4909,,,,,,Springer-Verlag,"London, UK, UK"
article,2384559,R&#252;diger  Breitschwerdt and Philipp  Reinke and Markus Kleine Sextro and Oliver  Thomas,,,,Process-oriented Application Systems for Mobile Services: Empirical Analysis of Healthcare Professionals' Intention,22--30,,9,"ambulant healthcare services, empirical survey, mobile application systems, process-oriented information systems, treatment workflows",10.1145/2384556.2384559,SIGHIT Rec.,Sep-12,2,2,,September,2012,2158-8813,,,,,,ACM,"New York, NY, USA"
article,1812547,Kelly  Hutchinson and Alemayehu  Molla,,,,Mapping the Dynamics of Social Enterprises and ICTD in Cambodia,163--172,,10,"CICs, Cambodia, ICT, ICTD, community informatics, international development, social enterprise",,,,,,,,2009,,Proceedings of the 3rd International Conference on Information and Communication Technologies and Development,ICTD'09,,978-1-4244-4662-9,"Doha, Qatar",IEEE Press,"Piscataway, NJ, USA"
article,2670785,G. Barbara Demo,,,,T4T: A Peer Training Model for In-service Teachers,120--121,,2,"computing science, introduction to informatics, open data, programming, teachers' training",10.1145/2670757.2670785,,,,,,,2014,,Proceedings of the 9th Workshop in Primary and Secondary Computing Education,WiPSCE '14,,978-1-4503-3250-7,"Berlin, Germany",ACM,"New York, NY, USA"
article,1979521,Sophia B. Liu,,,,Digital Commemoration: Surveying the Social Media Revival of Historical Crises,947--952,,6,"commemoration, crisis informatics, cyberinfrastructure, social media, survey, web sphere",10.1145/1979742.1979521,,,,,,,2011,,CHI '11 Extended Abstracts on Human Factors in Computing Systems,CHI EA '11,,978-1-4503-0268-5,"Vancouver, BC, Canada",ACM,"New York, NY, USA"
article,2686672,Wally  Smith and Greg  Wadley and Sarah  Webber and Bernd  Ploderer and Reeva  Lederman,,,,Unbounding the Interaction Design Problem: The Contribution of HCI in Three Interventions for Well-being,392--395,,4,"behaviour change, contribution of HCI, medical informatics, value chain",10.1145/2686612.2686672,,,,,,,2014,,Proceedings of the 26th Australian Computer-Human Interaction Conference on Designing Futures: The Future of Design,OzCHI '14,,978-1-4503-0653-9,"Sydney, New South Wales, Australia",ACM,"New York, NY, USA"
article,3297008,Manjira  Sinha and Satarupa  Guha and Preethy  Varma and Tridib  Mukherjee and Sandya  Mannarswamy,,,,"My City, My Voice: Listening to the Citizen Views from Web Sources",52--60,,9,"Issue Identification, Natural Language Processing, Urban Informatics, Web Data Mining",10.1145/3297001.3297008,,,,,,,2019,,Proceedings of the ACM India Joint International Conference on Data Science and Management of Data,CoDS-COMAD '19,,978-1-4503-6207-8,"Kolkata, India",ACM,"New York, NY, USA"
article,3162268,Isabella  Corradini and Michael  Lodi and Enrico  Nardelli,,,,Coding and Programming: What Do Italian Primary School Teachers Think? (Abstract Only),1074--1074,,1,"coding and programming, informatics education, primary school teachers",10.1145/3159450.3162268,,,,,,,2018,,Proceedings of the 49th ACM Technical Symposium on Computer Science Education,SIGCSE '18,,978-1-4503-5103-4,"Baltimore, Maryland, USA",ACM,"New York, NY, USA"
article,2132298,Conrad  Ng and Anatoliy  Gruzd and Calvino  Cheng and Bryan  Crocker and Don  Doiron and Kent  Stevens,,,,From Data to Knowledge: Discovery of Medical Laboratory Demand Patterns Through Visualisation Techniques,585--586,,2,"data visualization, health informatics, knowledge discovery, social network analysis",10.1145/2132176.2132298,,,,,,,2012,,Proceedings of the 2012 iConference,iConference '12,,978-1-4503-0782-6,"Toronto, Ontario, Canada",ACM,"New York, NY, USA"
article,2808812,Buket  Kaya and Mustafa  Poyraz,,,,Finding Relations Between Diseases by Age-Series Based Supervised Link Prediction,1097--1103,,7,"disease networks, health informatics, link prediction, supervised learning",10.1145/2808797.2808812,,,,,,,2015,,Proceedings of the 2015 IEEE/ACM International Conference on Advances in Social Networks Analysis and Mining 2015,ASONAM '15,,978-1-4503-3854-7,"Paris, France",ACM,"New York, NY, USA"
article,1062581,Matthew J. Hawthorne and Dewayne E. Perry,,,,"Software Engineering Education in the Era of Outsourcing, Distributed Development, and Open Source Software: Challenges and Opportunities",643--644,,2,"computer science education, contextual learning, education, informatics, software engineering education",10.1145/1062455.1062581,,,,,,,2005,,Proceedings of the 27th International Conference on Software Engineering,ICSE '05,,1-58113-963-2,"St. Louis, MO, USA",ACM,"New York, NY, USA"
article,2145212,Kate  Starbird and Leysia  Palen,,,,(How) Will the Revolution Be Retweeted?: Information Diffusion and the 2011 Egyptian Uprising,7--16,,10,"crisis informatics, information contagion, information diffusion, political disruption, twitter",10.1145/2145204.2145212,,,,,,,2012,,Proceedings of the ACM 2012 Conference on Computer Supported Cooperative Work,CSCW '12,,978-1-4503-1086-4,"Seattle, Washington, USA",ACM,"New York, NY, USA"
article,3024942,Jing  Zhang,,,,Supporting Information Needs of Transitional Phases in Diabetes Management Through Online Health Communities,107--111,,5,"chronic illness, diabetes, health informatics, information needs, online health communities",10.1145/3022198.3024942,,,,,,,2017,,Companion of the 2017 ACM Conference on Computer Supported Cooperative Work and Social Computing,CSCW '17 Companion,,978-1-4503-4688-7,"Portland, Oregon, USA",ACM,"New York, NY, USA"
article,2675212,Christopher A. Le Dantec and Mariam  Asad and Aditi  Misra and Kari E. Watkins,,,,Planning with Crowdsourced Data: Rhetoric and Representation in Transportation Planning,1717--1727,,11,"digital democracy, public participation, urban informatics, urban planning",10.1145/2675133.2675212,,,,,,,2015,,Proceedings of the 18th ACM Conference on Computer Supported Cooperative Work &#38; Social Computing,CSCW '15,,978-1-4503-2922-4,"Vancouver, BC, Canada",ACM,"New York, NY, USA"
